NAME,PLACEHOLDER,ROLE_OF_PLACEHOLDER,STANDARD_NAMES,SOURCE_SUPPLIER,SUPPLYING_COMPANY,FUNCTIONAL_ROLES,MENTIONED_EXAMPLES,IS_ACTIVE_INGREDIENT,IS_STRUCTURAL_COMPONENT
mineral salt,,,"calcium chloride, lithium chloride, magnesium chloride, potassium chloride, sodium chloride",,,"structural component, structural_component, viscosity modifier","calcium chloride, calcium sulfate, lithium chloride, lithium sulfate, magnesium chloride, magnesium sulfate, potassium nitrate, potassium sulfate, sodium sulfate",False,True
hydrous gel composition,,,,,,emulsion stabilizer,"vitreoscilla ferment, silica, boron nitride",False,True
water insoluble active ingredient,,,"vitreoscilla ferment, silica, boron nitride",,,skin conditioning agent,"vitreoscilla ferment, silica, boron nitride",True,False
"Crosslinked Acrylic Acid Homopolymer, crosslinked acrylic acid homopolymer",,,"Carbomer, Polyacrylic Acid",,,"emulsifier, viscosity modifier","allyl ether of pentaerythritol, allyl ether of propylene, allyl ether of sucrose, homopolymer of acrylic acid crosslinked with an allyl ether of pentaerythritol",False,True
"Sodium Alginate, sodium alginate, xanthan gum",,,"Algin, Ammonium Alginate, Potassium Alginate, Sodium Alginate, Xanthan Gum, Xanthan gum, ammonium alginate, potassium alginate, sodium alginate",,,"Emulsion Stabilizer, emulsion stabilizer, film forming agent, viscosity modifier","Ammonium Alginate, Potassium Alginate, Sodium Alginate, ammonium alginate, potassium alginate, sodium alginate",False,True
Vitreoscilla Ferment,,,Vitreoscilla Ferment,,,skin conditioning agent,,True,False
